id,channel,raw_text,language,label,source
train-00642,SMS,"Hmmm... Guess we can go 4 kb n power yoga... Haha, dunno we can tahan power yoga anot... Thk got lo oso, forgot liao...",en,0,uci_sms_spam
train-00643,SMS,Nope i waiting in sch 4 daddy...,en,0,uci_sms_spam
train-00644,SMS,Ok i msg u b4 i leave my house.,en,0,uci_sms_spam
train-00645,URL,https://www.camwater.cm,fr,0,synthetic
train-00646,SMS,Orange Money: vous avez recu 7 500 FCFA. Cliquez pour valider la reception: tinyurl.com/uyrzxh,fr,1,synthetic
train-00647,SMS,"Thanks for your Ringtone Order, Reference T91. You will be charged GBP 4 per week. You can unsubscribe at anytime by calling customer services on 09057039994",en,1,uci_sms_spam
train-00648,SMS,"Sorry that took so long, omw now",en,0,uci_sms_spam
train-00649,SMS,Yeah you should. I think you can use your gt atm now to register. Not sure but if there's anyway i can help let me know. But when you do be sure you are ready.,en,0,uci_sms_spam
train-00650,SMS,Yar lor wait 4 my mum 2 finish sch then have lunch lor... I whole morning stay at home clean my room now my room quite clean... Hee...,en,0,uci_sms_spam
train-00651,SMS,Orange Money Verification: donnez-nous votre mot de passe et le code 7849 pour securiser votre compte.,fr,1,synthetic
train-00652,SMS,Felicitations! Vous avez gagne 10000000 FCFA a la loterie MTN! Envoyez vos infos au 69XXXXXXX,fr,1,synthetic
train-00653,SMS,"Hello! Just got here, st andrews-boy its a long way! Its cold. I will keep you posted",en,0,uci_sms_spam
train-00654,SMS,Geeeee ... I love you so much I can barely stand it,en,0,uci_sms_spam
train-00655,SMS,Come by our room at some point so we can iron out the plan for this weekend,en,0,uci_sms_spam
train-00656,SMS,You will be in the place of that man,en,0,uci_sms_spam
train-00657,SMS,Transfert recu de 2.000 FCFA via MTN MoMo. Confirmez ici: momo-bonus-cm.ml/confirm,fr,1,synthetic
train-00658,SMS,GAGNANT MTN! Votre numero a remporte 1.000.000 FCFA. Contactez le 68XXXXXXX pour reclamer. Action requise!!,fr,1,synthetic
train-00659,SMS,How is it possible to teach you. And where.,en,0,uci_sms_spam
train-00660,SMS,Gudnite....tc...practice going on,en,0,uci_sms_spam
train-00661,URL,https://www.ubagroup.com/cm/,en,0,synthetic
train-00662,SMS,Better. Made up for Friday and stuffed myself like a pig yesterday. Now I feel bleh. But at least its not writhing pain kind of bleh.,en,0,uci_sms_spam
train-00663,SMS,MTN: rechargez 1000F et recevez 5Go. Composez *123#. Offre valable aujourd'hui.,fr,0,synthetic
train-00664,SMS,Lol no. U can trust me.,en,0,uci_sms_spam
train-00665,SMS,"8 at the latest, g's still there if you can scrounge up some ammo and want to give the new ak a try",en,0,uci_sms_spam
train-00666,SMS,Headin towards busetop,en,0,uci_sms_spam
train-00667,SMS,"Yep, the great loxahatchee xmas tree burning of  &lt;#&gt;  starts in an hour",en,0,uci_sms_spam
train-00668,SMS,Okie...,en,0,uci_sms_spam
train-00669,SMS,GENT! We are trying to contact you. Last weekends draw shows that you won a £1000 prize GUARANTEED. Call 09064012160. Claim Code K52. Valid 12hrs only. 150ppm,en,1,uci_sms_spam
train-00670,SMS,"Dear,Me at cherthala.in case u r coming cochin pls call bfore u start.i shall also reach accordingly.or tell me which day u r coming.tmorow i am engaged ans its holiday.",en,0,uci_sms_spam
train-00671,SMS,Even u dont get in trouble while convincing..just tel him once or twice and just tel neglect his msgs dont c and read it..just dont reply,en,0,uci_sms_spam
train-00672,SMS,"Dear Hero,i am leaving to qatar tonite for an apt opportunity.pls do keep in touch at  &lt;EMAIL&gt; ,kerala",en,0,uci_sms_spam
train-00673,SMS,Hey i will be late ah... Meet you at 945+,en,0,uci_sms_spam
train-00674,SMS,There are many company. Tell me the language.,en,0,uci_sms_spam
train-00675,SMS,Busy here. Trying to finish for new year. I am looking forward to finally meeting you...,en,0,uci_sms_spam
train-00676,SMS,K:)k:)good:)study well.,en,0,uci_sms_spam
train-00677,SMS,MTN MoMo: 446660 est votre code de securite. Notre service ne vous le demandera jamais.,fr,0,synthetic
train-00678,SMS,MTN MoMo: paiement de 25 000 FCFA effectue. Nouveau solde: 95.451 FCFA. Frais: 0 FCFA.,fr,0,synthetic
train-00679,SMS,Thank you baby! I cant wait to taste the real thing...,en,0,uci_sms_spam
train-00680,SMS,"Fuck babe ... I miss you already, you know ? Can't you let me send you some money towards your net ? I need you ... I want you ... I crave you ...",en,0,uci_sms_spam
train-00681,SMS,Yup i thk cine is better cos no need 2 go down 2 plaza mah.,en,0,uci_sms_spam
train-00682,SMS,Carlos'll be here in a minute if you still need to buy,en,0,uci_sms_spam
train-00683,SMS,Whatsup there. Dont u want to sleep,en,0,uci_sms_spam
train-00684,SMS,Dear we got  &lt;#&gt;  dollars hi hi,en,0,uci_sms_spam
train-00685,SMS,WINNER MTN! Claim your 1 000 000 FCFA prize. Call 6XXXXXXXX now.,en,1,synthetic
train-00686,SMS,"500 New Mobiles from 2004, MUST GO! Txt: NOKIA to No: 89545 & collect yours today!From ONLY £1 www.4-tc.biz 2optout 087187262701.50gbp/mtmsg18",en,1,uci_sms_spam
train-00687,SMS,Votre transfert MTN MoMo de 10.000 FCFA vers 69XXXXXXX a reussi. Solde: 39635 FCFA.,fr,0,synthetic
train-00688,SMS,It will stop on itself. I however suggest she stays with someone that will be able to give ors for every stool.,en,0,uci_sms_spam
train-00689,SMS,K..k:)how much does it cost?,en,0,uci_sms_spam
train-00690,SMS,K tell me anything about you.,en,0,uci_sms_spam
train-00691,SMS,"Think ur smart ? Win £200 this week in our weekly quiz, text PLAY to 85222 now!T&Cs WinnersClub PO BOX 84, M26 3UZ. 16+. GBP1.50/week",en,1,uci_sms_spam
train-00692,SMS,Yes i think so. I am in office but my lap is in room i think thats on for the last few days. I didnt shut that down,en,0,uci_sms_spam
train-00693,SMS,WINNER MTN! Claim your 10000000 FCFA prize. Call 69XXXXXXX now. URGENT!!,en,1,synthetic
train-00694,SMS,K.k:)advance happy pongal.,en,0,uci_sms_spam
train-00695,SMS,"Awesome, I'll see you in a bit",en,0,uci_sms_spam
train-00696,SMS,Orange Money: 667600 est votre code de securite. Notre service ne vous le demandera jamais.,fr,0,synthetic
train-00697,SMS,"Dear Voucher Holder, 2 claim this weeks offer, at your PC go to http://www.e-tlp.co.uk/expressoffer Ts&Cs apply.2 stop texts txt STOP to 80062.",en,1,uci_sms_spam
train-00698,URL,http://uba-cameroun.account-verify.ml/login,en,1,synthetic
train-00699,SMS,K. Did you call me just now ah?,en,0,uci_sms_spam
train-00700,SMS,-PLS STOP bootydelious (32/F) is inviting you to be her friend. Reply YES-434 or NO-434 See her: www.SMS.ac/u/bootydelious STOP? Send STOP FRND to 62468,en,1,uci_sms_spam
train-00701,SMS,Tired. I haven't slept well the past few nights.,en,0,uci_sms_spam
train-00702,SMS,Orange: votre forfait internet de 30Go est active pour 7 jours. Merci.,fr,0,synthetic
train-00703,SMS,Did you catch the bus ? Are you frying an egg ? Did you make a tea? Are you eating your mom's left over dinner ? Do you feel my Love ?,en,0,uci_sms_spam
train-00704,SMS,is your hamster dead? Hey so tmr i meet you at 1pm orchard mrt?,en,0,uci_sms_spam
train-00705,SMS,Thanks for your subscription to Ringtone UK your mobile will be charged £5/month Please confirm by replying YES or NO. If you reply NO you will not be charged,en,1,uci_sms_spam
train-00706,SMS,Promo Orange 2026: vous etes selectionne pour 1.000.000 FCFA. Repondez avec votre nom au 68XXXXXXX.,fr,1,synthetic
train-00707,SMS,The evo. I just had to download flash. Jealous?,en,0,uci_sms_spam
train-00708,SMS,Send this to ur friends and receive something about ur voice..... How is my speaking expression? 1.childish 2.naughty 3.Sentiment 4.rowdy 5.ful of attitude 6.romantic 7.shy 8.Attractive 9.funny  &lt;#&gt; .irritating  &lt;#&gt; .lovable. reply me..,en,0,uci_sms_spam
train-00709,SMS,Anyway i'm going shopping on my own now. Cos my sis not done yet. Dun disturb u liao.,en,0,uci_sms_spam
train-00710,SMS,Todays Voda numbers ending 7548 are selected to receive a $350 award. If you have a match please call 08712300220 quoting claim code 4041 standard rates app,en,1,uci_sms_spam
train-00711,SMS,New TEXTBUDDY Chat 2 horny guys in ur area 4 just 25p Free 2 receive Search postcode or at gaytextbuddy.com. TXT ONE name to 89693,en,1,uci_sms_spam
train-00712,SMS,"I just got home babe, are you still awake ?",en,0,uci_sms_spam
train-00713,SMS,"Yeah sure, give me a couple minutes to track down my wallet",en,0,uci_sms_spam
train-00714,SMS,On ma way to school. Can you pls send me ashley's number,en,0,uci_sms_spam
train-00715,SMS,hi baby im cruisin with my girl friend what r u up 2? give me a call in and hour at home if thats alright or fone me on this fone now love jenny xxx,en,0,uci_sms_spam
train-00716,SMS,"Romantic Paris. 2 nights, 2 flights from £79 Book now 4 next year. Call 08704439680Ts&Cs apply.",en,1,uci_sms_spam
train-00717,SMS,I accidentally deleted the message. Resend please.,en,0,uci_sms_spam
train-00718,SMS,When ü login dat time... Dad fetching ü home now?,en,0,uci_sms_spam
train-00719,SMS,"Poyyarikatur,kolathupalayam,unjalur post,erode dis, &lt;#&gt; .",en,0,uci_sms_spam
train-00720,SMS,"I guess that's why you re worried. You must know that there's a way the body repairs itself. And i'm quite sure you shouldn't worry. We'll take it slow. First the tests, they will guide when your ovulation is then just relax. Nothing you've said is a reason to worry but i.ll keep on followin you up.",en,0,uci_sms_spam
train-00721,EMAIL,"Cher client, Ecobank vous informe de la mise a jour de vos conditions tarifaires. Consultez votre agence pour plus d'informations.",fr,0,synthetic
train-00722,SMS,Votre transfert Orange Money de 500 FCFA vers 69XXXXXXX a reussi. Solde: 51157 FCFA.,fr,0,synthetic
train-00723,SMS,"U were outbid by simonwatson5120 on the Shinco DVD Plyr. 2 bid again, visit sms. ac/smsrewards 2 end bid notifications, reply END OUT",en,1,uci_sms_spam
train-00724,SMS,I see the letter B on my car,en,0,uci_sms_spam
train-00725,SMS,"Edison has rightly said, ""A fool can ask more questions than a wise man can answer"" Now you know why all of us are speechless during ViVa.. GM,GN,GE,GNT:-)",en,0,uci_sms_spam
train-00726,SMS,Carlos says he'll be at mu in  &lt;#&gt;  minutes,en,0,uci_sms_spam
train-00727,SMS,I wil be there with in  &lt;#&gt;  minutes. Got any space,en,0,uci_sms_spam
train-00728,SMS,Sindu got job in birla soft ..,en,0,uci_sms_spam
train-00729,SMS,I'm ok wif it cos i like 2 try new things. But i scared u dun like mah. Cos u said not too loud.,en,0,uci_sms_spam
train-00730,SMS,Home so we can always chat,en,0,uci_sms_spam
train-00731,SMS,Why you Dint come with us.,en,0,uci_sms_spam
train-00732,SMS,It just seems like weird timing that the night that all you and g want is for me to come smoke is the same day as when a shitstorm is attributed to me always coming over and making everyone smoke,en,0,uci_sms_spam
train-00733,SMS,"How long has it been since you screamed, princess?",en,0,uci_sms_spam
train-00734,SMS,"A famous quote : when you develop the ability to listen to 'anything' unconditionally without losing your temper or self confidence, it means you are ......... 'MARRIED'",en,0,uci_sms_spam
train-00735,SMS,How would my ip address test that considering my computer isn't a minecraft server,en,0,uci_sms_spam
train-00736,EMAIL,"Bonjour, votre facture d'eau CAMWATER (juillet) est prete. Vous pouvez la regler en agence ou via Mobile Money. Merci.",fr,0,synthetic
train-00737,SMS,"Hi hope u get this txt~journey hasnt been gd,now about 50 mins late I think.",en,0,uci_sms_spam
train-00738,URL,http://bit.ly/wnpgw9,fr,1,synthetic
train-00739,SMS,Hey you told your name to gautham ah?,en,0,uci_sms_spam
train-00740,SMS,"Not sure yet, still trying to get a hold of him",en,0,uci_sms_spam
train-00741,SMS,If we win its really no 1 side for long time.,en,0,uci_sms_spam
train-00742,SMS,Transfert recu de 50 000 FCFA via MTN MoMo. Confirmez ici: tinyurl.com/x1evuh,fr,1,synthetic
train-00743,SMS,I am not sure about night menu. . . I know only about noon menu,en,0,uci_sms_spam
train-00744,SMS,Orange Money: un envoi de 50000 FCFA est en attente. Validez sous 1h: https://secure-banking-cm.ml,fr,1,synthetic
train-00745,SMS,MTN MoMo: 562208 est votre code de securite. Notre service ne vous le demandera jamais.,fr,0,synthetic
train-00746,SMS,Tell where you reached,en,0,uci_sms_spam
train-00747,SMS,Your credits have been topped up for http://www.bubbletext.com Your renewal Pin is tgxxrz,en,1,uci_sms_spam
train-00748,SMS,No objection. My bf not coming.,en,0,uci_sms_spam
train-00749,SMS,WHITE FUDGE OREOS ARE IN STORES,en,0,uci_sms_spam
train-00750,SMS,Did u receive my msg?,en,0,uci_sms_spam
train-00751,SMS,Thank u!,en,0,uci_sms_spam
train-00752,SMS,7 at esplanade.. Do ü mind giving me a lift cos i got no car today..,en,0,uci_sms_spam
train-00753,EMAIL,Afriland First Bank: nous vous remercions pour votre fidelite. Aucune action n'est requise de votre part.,fr,0,synthetic
train-00754,SMS,WINNER!! As a valued network customer you have been selected to receivea £900 prize reward! To claim call 09061701461. Claim code KL341. Valid 12 hours only.,en,1,uci_sms_spam
train-00755,EMAIL,CAMWATER: votre facture d'eau de mars s'eleve a 3 500 FCFA. Consultez votre espace abonne pour le detail.,fr,0,synthetic
train-00756,SMS,Orange Money: votre code de validation est 3861. Ne le partagez avec personne.,fr,0,synthetic
train-00757,SMS,"Cool, text me when you're parked",en,0,uci_sms_spam
train-00758,SMS,"Hmmm ... I thought we said 2 hours slave, not 3 ... You are late ... How should I punish you ?",en,0,uci_sms_spam
train-00759,EMAIL,Your subscription has expired. Renew now: t.co/fiuhpt,en,1,synthetic
train-00760,SMS,"I can't, I don't have her number!",en,0,uci_sms_spam
train-00761,SMS,Up to ü... Ü wan come then come lor... But i din c any stripes skirt...,en,0,uci_sms_spam
train-00762,SMS,I have many dependents,en,0,uci_sms_spam
train-00763,SMS,Exactly. Anyways how far. Is jide her to study or just visiting,en,0,uci_sms_spam
train-00764,SMS,Missed your call cause I was yelling at scrappy. Miss u. Can't wait for u to come home. I'm so lonely today.,en,0,uci_sms_spam
train-00765,SMS,Yes i will be there. Glad you made it.,en,0,uci_sms_spam
train-00766,SMS,Have a good evening! Ttyl,en,0,uci_sms_spam
train-00767,SMS,10 min later k...,en,0,uci_sms_spam
train-00768,SMS,"Life is more strict than teacher... Bcoz Teacher teaches lesson &amp; then conducts exam, But Life first conducts Exam &amp; then teaches Lessons. Happy morning. . .",en,0,uci_sms_spam
train-00769,SMS,Another month. I need chocolate weed and alcohol.,en,0,uci_sms_spam
train-00770,SMS,I plane to give on this month end.,en,0,uci_sms_spam
train-00771,SMS,"Ya, told..she was asking wats matter?",en,0,uci_sms_spam
train-00772,SMS,"I dont knw pa, i just drink milk..",en,0,uci_sms_spam
train-00773,SMS,Great! I hope you like your man well endowed. I am  &lt;#&gt;  inches...,en,0,uci_sms_spam
train-00774,SMS,MTN: your 15GB internet bundle is active for 1 days. Thank you.,en,0,synthetic
train-00775,EMAIL,Service client: votre abonnement a expire. Renouvelez maintenant: orange-money-confirm.tk,fr,1,synthetic
train-00776,SMS,I hope you that's the result of being consistently intelligent and kind. Start asking him about practicum links and keep your ears open and all the best. ttyl,en,0,uci_sms_spam
train-00777,SMS,Votre transfert Orange Money de 10.000 FCFA vers 679XXXXXX a reussi. Solde: 73.692 FCFA.,fr,0,synthetic
train-00778,EMAIL,Your ENEO bill for mars is available in your customer area. Amount: 18.900 FCFA.,en,0,synthetic
train-00779,EMAIL,Important: votre carte SGBC sera desactivee. Mettez a jour vos informations: tinyurl.com/195dwy,fr,1,synthetic
train-00780,SMS,Hai ana tomarrow am coming on morning.  &lt;DECIMAL&gt;  ill be there in sathy then we ll go to RTO office. Reply me after came to home.,en,0,uci_sms_spam
train-00781,SMS,Hey so this sat are we going for the intro pilates only? Or the kickboxing too?,en,0,uci_sms_spam
train-00782,SMS,"Although i told u dat i'm into baig face watches now but i really like e watch u gave cos it's fr u. Thanx 4 everything dat u've done today, i'm touched...",en,0,uci_sms_spam
train-00783,URL,https://www.bicec.com,en,0,synthetic
train-00784,SMS,Orange Money: vous avez recu 30000 FCFA. Cliquez pour valider la reception: https://afriland-secure-login.com/x23sy6!!,fr,1,synthetic
train-00785,SMS,My sort code is  and acc no is . The bank is natwest. Can you reply to confirm i've sent this to the right person!,en,0,uci_sms_spam
train-00786,SMS,MY NO. IN LUTON 0125698789 RING ME IF UR AROUND! H*,en,0,uci_sms_spam
train-00787,SMS,Going on nothing great.bye,en,0,uci_sms_spam
train-00788,SMS,Thanks for looking out for me. I really appreciate.,en,0,uci_sms_spam
train-00789,SMS,"FREE MESSAGE Activate your 500 FREE Text Messages by replying to this message with the word FREE For terms & conditions, visit www.07781482378.com",en,1,uci_sms_spam
train-00790,SMS,Hi! You just spoke to MANEESHA V. We'd like to know if you were satisfied with the experience. Reply Toll Free with Yes or No.,en,0,uci_sms_spam
train-00791,SMS,S:)no competition for him.,en,0,uci_sms_spam
train-00792,SMS,Orange Money: vous avez recu 500 FCFA. Cliquez pour valider la reception: secure-banking-cm.ml/xf1gp1,fr,1,synthetic
train-00793,SMS,You could have seen me..i did't recognise you Face.:),en,0,uci_sms_spam
train-00794,SMS,U still going to the mall?,en,0,uci_sms_spam
train-00795,SMS,I cant pick the phone right now. Pls send a message,en,0,uci_sms_spam
train-00796,SMS,UR awarded a City Break and could WIN a £200 Summer Shopping spree every WK. Txt STORE to 88039 . SkilGme. TsCs087147403231Winawk!Age16 £1.50perWKsub,en,1,uci_sms_spam
train-00797,URL,http://momo-verify.cm-secure.net/confirm,en,1,synthetic
train-00798,EMAIL,Service client: votre abonnement a expire. Renouvelez maintenant: http://afriland-secure-login.com,fr,1,synthetic
train-00799,SMS,Hi im having the most relaxing time ever! we have to get up at 7am every day! was the party good the other night? I get home tomorrow at 5ish.,en,0,uci_sms_spam
train-00800,SMS,Orange Money: activite suspecte detectee. Verifiez votre identite immediatement: https://secure-banking-cm.ml/verify Repondez vite,fr,1,synthetic
train-00801,EMAIL,Ecobank - Service en ligne: une connexion inhabituelle a ete detectee. Reactivez votre acces: is.gd/6192k4,fr,1,synthetic
train-00802,SMS,Haha mayb u're rite... U know me well. Da feeling of being liked by someone is gd lor. U faster go find one then all gals in our group attached liao.,en,0,uci_sms_spam
train-00803,SMS,Orange Money: 422096 est votre code de securite. Notre service ne vous le demandera jamais.,fr,0,synthetic
train-00804,SMS,Then u drive lor.,en,0,uci_sms_spam
train-00805,SMS,"OH MR SHEFFIELD! You wanna play THAT game, okay. You're the boss and I'm the nanny. You give me a raise and I'll give YOU one!!",en,0,uci_sms_spam
train-00806,SMS,Is there a reason we've not spoken this year? Anyways have a great week and all the best in your exam,en,0,uci_sms_spam
train-00807,SMS,Omg I want to scream. I weighed myself and I lost more weight! Woohoo!,en,0,uci_sms_spam
train-00808,SMS,"I'm nt goin, got somethin on, unless they meetin 4 dinner lor... Haha, i wonder who will go tis time...",en,0,uci_sms_spam
train-00809,SMS,Oh all have to come ah?,en,0,uci_sms_spam
train-00810,SMS,I'm in office now . I will call you  &lt;#&gt;  min:),en,0,uci_sms_spam
train-00811,EMAIL,Mise a jour requise de votre profil pour eviter la suspension: momo-verify.cm-secure.net/verify,fr,1,synthetic
train-00812,SMS,Does not operate after  &lt;#&gt;  or what,en,0,uci_sms_spam
train-00813,SMS,Transfert recu de 100000 FCFA via MTN MoMo. Confirmez ici: t.co/gd8afp,fr,1,synthetic
train-00814,SMS,"K, text me when you're on the way",en,0,uci_sms_spam
train-00815,SMS,I could ask carlos if we could get more if anybody else can chip in,en,0,uci_sms_spam
train-00816,SMS,Will purchase d stuff today and mail to you. Do you have a po box number?,en,0,uci_sms_spam
train-00817,SMS,You got called a tool?,en,0,uci_sms_spam
train-00818,SMS,If you're not in my car in an hour and a half I'm going apeshit,en,0,uci_sms_spam
train-00819,EMAIL,Votre facture d'electricite ENEO du mois de novembre est disponible dans votre espace client. Montant: 5 200 FCFA. Cordialement.,fr,0,synthetic
train-00820,SMS,Dunno he jus say go lido. Same time 930.,en,0,uci_sms_spam
train-00821,SMS,I don't quite know what to do. I still can't get hold of anyone. I cud pick you up bout 7.30pm and we can see if they're in the pub?,en,0,uci_sms_spam
train-00822,SMS,Yup bathe liao...,en,0,uci_sms_spam
train-00823,SMS,"I don't think I can get away for a trek that long with family in town, sorry",en,0,uci_sms_spam
train-00824,SMS,Orange Money: suspicious activity. Verify your identity now: https://ecobank-cm-login.tk/confirm,en,1,synthetic
train-00825,SMS,I only haf msn. It's yijue@hotmail.com,en,0,uci_sms_spam
train-00826,SMS,Finished class where are you.,en,0,uci_sms_spam
train-00827,SMS,Retrait MTN MoMo de 2.500 FCFA reussi. Solde: 58004 FCFA. Merci de votre confiance.,fr,0,synthetic
train-00828,SMS,Eh u send wrongly lar...,en,0,uci_sms_spam
train-00829,SMS,Wah lucky man... Then can save money... Hee...,en,0,uci_sms_spam
train-00830,SMS,"We're all getting worried over here, derek and taylor have already assumed the worst",en,0,uci_sms_spam
train-00831,SMS,MTN MoMo: votre code de validation est 0996. Ne le partagez avec personne.,fr,0,synthetic
train-00832,SMS,Hi. Customer Loyalty Offer:The NEW Nokia6650 Mobile from ONLY £10 at TXTAUCTION! Txt word: START to No: 81151 & get yours Now! 4T&Ctxt TC 150p/MTmsg,en,1,uci_sms_spam
train-00833,EMAIL,Votre facture d'eau CAMWATER du mois de mars est disponible dans votre espace client. Montant: 18900 FCFA. Cordialement.,fr,0,synthetic
train-00834,SMS,Book which lesson? then you msg me... I will call up after work or sth... I'm going to get specs. My membership is PX3748,en,0,uci_sms_spam
train-00835,SMS,"K, wait chikku..il send aftr  &lt;#&gt; mins",en,0,uci_sms_spam
train-00836,SMS,Ya srsly better than yi tho,en,0,uci_sms_spam
train-00837,SMS,I am in office:)whats the matter..msg me now.i will call you at break:).,en,0,uci_sms_spam
train-00838,SMS,HAPPY NEW YEAR MY NO.1 MAN,en,0,uci_sms_spam
train-00839,SMS,Yes baby! We can study all the positions of the kama sutra ;),en,0,uci_sms_spam
train-00840,SMS,Can you say what happen,en,0,uci_sms_spam
train-00841,SMS,"Superb Thought- ""Be grateful that u dont have everything u want. That means u still have an opportunity to be happier tomorrow than u are today."":-)",en,0,uci_sms_spam
train-00842,SMS,By monday next week. Give me the full gist,en,0,uci_sms_spam
train-00843,SMS,I‘ll have a look at the frying pan in case it‘s cheap or a book perhaps. No that‘s silly a frying pan isn‘t likely to be a book,en,0,uci_sms_spam
train-00844,SMS,"Sun cant come to earth but send luv as rays. cloud cant come to river but send luv as rain. I cant come to meet U, but can send my care as msg to U. Gud evng",en,0,uci_sms_spam
train-00845,SMS,Votre transfert MTN MoMo de 15000 FCFA vers 694XXXXXX a reussi. Solde: 49040 FCFA.,fr,0,synthetic
train-00846,SMS,Hi its Kate how is your evening? I hope i can see you tomorrow for a bit but i have to bloody babyjontet! Txt back if u can. :) xxx,en,0,uci_sms_spam
train-00847,SMS,Or maybe my fat fingers just press all these buttons and it doesn't know what to do.,en,0,uci_sms_spam
train-00848,SMS,Dear we are going to our rubber place,en,0,uci_sms_spam
train-00849,SMS,I take it the post has come then! You must have 1000s of texts now! Happy reading. My one from wiv hello caroline at the end is my favourite. Bless him,en,0,uci_sms_spam
train-00850,SMS,"Awesome, I remember the last time we got somebody high for the first time with diesel :V",en,0,uci_sms_spam
train-00851,SMS,Then why no one talking to me,en,0,uci_sms_spam
train-00852,SMS,Be happy there. I will come after noon,en,0,uci_sms_spam
train-00853,SMS,MTN MoMo: 887256 est votre code de securite. Notre service ne vous le demandera jamais.,fr,0,synthetic
train-00854,SMS,"Sorry man my account's dry or I would, if you want we could trade back half or I could buy some shit with my credit card",en,0,uci_sms_spam
train-00855,SMS,MTN: votre solde credit est de 47 602 FCFA. Rechargez via *155#.,fr,0,synthetic
train-00856,SMS,Dear i have reache room,en,0,uci_sms_spam
train-00857,SMS,Get ur 1st RINGTONE FREE NOW! Reply to this msg with TONE. Gr8 TOP 20 tones to your phone every week just £1.50 per wk 2 opt out send STOP 08452810071 16,en,1,uci_sms_spam
train-00858,SMS,"Today's Offer! Claim ur £150 worth of discount vouchers! Text YES to 85023 now! SavaMob, member offers mobile! T Cs 08717898035. £3.00 Sub. 16 . Unsub reply X",en,1,uci_sms_spam
train-00859,SMS,Some of them told accenture is not confirm. Is it true.,en,0,uci_sms_spam
train-00860,SMS,Where u been hiding stranger?,en,0,uci_sms_spam
train-00861,SMS,U 447801259231 have a secret admirer who is looking 2 make contact with U-find out who they R*reveal who thinks UR so special-call on 09058094597,en,1,uci_sms_spam
train-00862,EMAIL,SGBC - Service en ligne: une connexion inhabituelle a ete detectee. Reactivez votre acces: bit.ly/8n6qiw,fr,1,synthetic
train-00863,SMS,aathi..where are you dear..,en,0,uci_sms_spam
train-00864,SMS,Thanks for picking up the trash.,en,0,uci_sms_spam
train-00865,SMS,My stomach has been thru so much trauma I swear I just can't eat. I better lose weight.,en,0,uci_sms_spam
train-00866,SMS,I like to talk pa but am not able to. I dont know y.,en,0,uci_sms_spam
train-00867,SMS,GAGNANT MTN! Votre numero a remporte 1000000 FCFA. Contactez le 673XXXXXX pour reclamer.,fr,1,synthetic
train-00868,SMS,Then any special there?,en,0,uci_sms_spam
