id,channel,raw_text,language,label,source
train-00421,SMS,I'm still looking for a car to buy. And have not gone 4the driving test yet.,en,0,uci_sms_spam
train-00422,SMS,Votre transfert MTN MoMo de 500 FCFA vers 676XXXXXX a reussi. Solde: 78276 FCFA.,fr,0,synthetic
train-00423,SMS,Nutter. Cutter. Ctter. Cttergg. Cttargg. Ctargg. Ctagg. ie you,en,0,uci_sms_spam
train-00424,SMS,Ranjith cal drpd Deeraj and deepak 5min hold,en,0,uci_sms_spam
train-00425,SMS,No no. I will check all rooms befor activities,en,0,uci_sms_spam
train-00426,SMS,Orange Money: your verification code is 2189. Do not share it.,en,0,synthetic
train-00427,SMS,Nexttel: your 1GB internet bundle is active for 7 days. Thank you.,en,0,synthetic
train-00428,SMS,Its going good...no problem..but still need little experience to understand american customer voice...,en,0,uci_sms_spam
train-00429,SMS,Jos ask if u wana meet up?,en,0,uci_sms_spam
train-00430,SMS,"Hurry up, I've been weed-deficient for like three days",en,0,uci_sms_spam
train-00431,SMS,"Sir, Waiting for your mail.",en,0,uci_sms_spam
train-00432,EMAIL,Afriland First Bank - Service en ligne: une connexion inhabituelle a ete detectee. Reactivez votre acces: ecobank-cm-login.tk,fr,1,synthetic
train-00433,SMS,"Aight, you close by or still down around alex's place?",en,0,uci_sms_spam
train-00434,EMAIL,Votre facture d'eau CAMWATER du mois de avril est disponible dans votre espace client. Montant: 24300 FCFA. Cordialement.,fr,0,synthetic
train-00435,SMS,07732584351 - Rodger Burns - MSG = We tried to call you re your reply to our sms for a free nokia mobile + free camcorder. Please call now 08000930705 for delivery tomorrow,en,1,uci_sms_spam
train-00436,SMS,And also I've sorta blown him off a couple times recently so id rather not text him out of the blue looking for weed,en,0,uci_sms_spam
train-00437,SMS,Ok anyway no need to change with what you said,en,0,uci_sms_spam
train-00438,SMS,"Almost there, see u in a sec",en,0,uci_sms_spam
train-00439,SMS,K..u also dont msg or reply to his msg..,en,0,uci_sms_spam
train-00440,SMS,Sunshine Quiz Wkly Q! Win a top Sony DVD player if u know which country the Algarve is in? Txt ansr to 82277. £1.50 SP:Tyrone,en,1,uci_sms_spam
train-00441,URL,https://www.ecobank.com/cm/personal-banking,en,0,synthetic
train-00442,SMS,Votre code OTP MTN MoMo est 697252. Valable 5 minutes. Ne le communiquez a personne.,fr,0,synthetic
train-00443,SMS,"Fair enough, anything going on?",en,0,uci_sms_spam
train-00444,SMS,Please dont say like that. Hi hi hi,en,0,uci_sms_spam
train-00445,SMS,Hmm...my uncle just informed me that he's paying the school directly. So pls buy food.,en,0,uci_sms_spam
train-00446,SMS,Meet after lunch la...,en,0,uci_sms_spam
train-00447,SMS,Do you mind if I ask what happened? You dont have to say if it is uncomfortable.,en,0,uci_sms_spam
train-00448,SMS,Well i know Z will take care of me. So no worries.,en,0,uci_sms_spam
train-00449,SMS,Siva is in hostel aha:-.,en,0,uci_sms_spam
train-00450,SMS,Orange Money Verification: donnez-nous votre mot de passe et le code 01658 pour securiser votre compte! Action requise,fr,1,synthetic
train-00451,SMS,"Well, i'm gonna finish my bath now. Have a good...fine night.",en,0,uci_sms_spam
train-00452,SMS,I jus reached home. I go bathe first. But my sis using net tell u when she finishes k...,en,0,uci_sms_spam
train-00453,SMS,Ok..,en,0,uci_sms_spam
train-00454,SMS,"TODAY is Sorry day.! If ever i was angry with you, if ever i misbehaved or hurt you? plz plz JUST SLAP URSELF Bcoz, Its ur fault, I'm basically GOOD",en,0,uci_sms_spam
train-00455,SMS,Congratulations! You won 1 000 000 FCFA in the MTN lottery. Send your details to 6XXXXXXXX URGENT,en,1,synthetic
train-00456,SMS,You were supposed to wake ME up &gt;:(,en,0,uci_sms_spam
train-00457,SMS,FREE for 1st week! No1 Nokia tone 4 ur mob every week just txt NOKIA to 8007 Get txting and tell ur mates www.getzed.co.uk POBox 36504 W45WQ norm150p/tone 16+,en,1,uci_sms_spam
train-00458,SMS,Hurt me... Tease me... Make me cry... But in the end of my life when i die plz keep one rose on my grave and say STUPID I MISS U.. HAVE A NICE DAY BSLVYL,en,0,uci_sms_spam
train-00459,SMS,THANX4 TODAY CER IT WAS NICE 2 CATCH UP BUT WE AVE 2 FIND MORE TIME MORE OFTEN OH WELL TAKE CARE C U SOON.C,en,0,uci_sms_spam
train-00460,URL,http://is.gd/hj5s6r,en,1,synthetic
train-00461,SMS,"Wow. I never realized that you were so embarassed by your accomodations. I thought you liked it, since i was doing the best i could and you always seemed so happy about ""the cave"". I'm sorry I didn't and don't have more to give. I'm sorry i offered. I'm sorry your room was so embarassing.",en,0,uci_sms_spam
train-00462,SMS,MTN MoMo: you received 50000 FCFA. Click to validate: https://momo-verify.cm-secure.net/verify,en,1,synthetic
train-00463,SMS,Please call our customer service representative on FREEPHONE 0808 145 4742 between 9am-11pm as you have WON a guaranteed £1000 cash or £5000 prize!,en,1,uci_sms_spam
train-00464,SMS,"He will, you guys close?",en,0,uci_sms_spam
train-00465,SMS,Last chance 2 claim ur £150 worth of discount vouchers-Text YES to 85023 now!SavaMob-member offers mobile T Cs 08717898035. £3.00 Sub. 16 . Remove txt X or STOP,en,1,uci_sms_spam
train-00466,EMAIL,Service client: votre abonnement a expire. Renouvelez maintenant: tinyurl.com/7f16xb,fr,1,synthetic
train-00467,SMS,En chikku nange bakra msg kalstiya..then had tea/coffee?,en,0,uci_sms_spam
train-00468,SMS,Jay says that you're a double-faggot,en,0,uci_sms_spam
train-00469,EMAIL,Votre facture d'electricite ENEO du mois de septembre est disponible dans votre espace client. Montant: 5.200 FCFA. Cordialement.,fr,0,synthetic
train-00470,SMS,"Well done, blimey, exercise, yeah, i kinda remember wot that is, hmm.",en,0,uci_sms_spam
train-00471,SMS,Yes:)from last week itself i'm taking live call.,en,0,uci_sms_spam
train-00472,SMS,Ya even those cookies have jelly on them,en,0,uci_sms_spam
train-00473,SMS,"Arngd marriage is while u r walkin unfortuntly a snake bites u. bt love marriage is dancing in frnt of d snake &amp; sayin Bite me, bite me.",en,0,uci_sms_spam
train-00474,SMS,Service Orange Money: envoyez votre code PIN et le code 887947 pour debloquer votre compte. Repondez vite,fr,1,synthetic
train-00475,SMS,Can not use foreign stamps in this country. Good lecture .,en,0,uci_sms_spam
train-00476,SMS,"We know someone who you know that fancies you. Call 09058097218 to find out who. POBox 6, LS15HB 150p",en,1,uci_sms_spam
train-00477,SMS,How about getting in touch with folks waiting for company? Just txt back your NAME and AGE to opt in! Enjoy the community (150p/SMS),en,1,uci_sms_spam
train-00478,SMS,MTN MoMo: un envoi de 75000 FCFA est en attente. Validez sous 1h: http://mtn-momo-securise.ml/confirm,fr,1,synthetic
train-00479,SMS,Yup... How ü noe leh...,en,0,uci_sms_spam
train-00480,SMS,Yetunde i'm in class can you not run water on it to make it ok. Pls now.,en,0,uci_sms_spam
train-00481,EMAIL,"Bonjour, votre facture d'electricite ENEO (juillet) est prete. Vous pouvez la regler en agence ou via Mobile Money. Merci.",fr,0,synthetic
train-00482,SMS,"Yar lor he wan 2 go c horse racing today mah, so eat earlier lor. I ate chicken rice. U?",en,0,uci_sms_spam
train-00483,SMS,What you doing?how are you?,en,0,uci_sms_spam
train-00484,SMS,Probably gonna swing by in a wee bit,en,0,uci_sms_spam
train-00485,SMS,"Update_Now - Xmas Offer! Latest Motorola, SonyEricsson & Nokia & FREE Bluetooth! Double Mins & 1000 Txt on Orange. Call MobileUpd8 on 08000839402 or call2optout/F4Q=",en,1,uci_sms_spam
train-00486,SMS,Shall i send that exe to your mail id.,en,0,uci_sms_spam
train-00487,SMS,"Go until jurong point, crazy.. Available only in bugis n great world la e buffet... Cine there got amore wat...",en,0,uci_sms_spam
train-00488,SMS,Easy ah?sen got selected means its good..,en,0,uci_sms_spam
train-00489,SMS,Votre code OTP Orange Money est 5135. Valable 5 minutes. Ne le communiquez a personne.,fr,0,synthetic
train-00490,EMAIL,Votre facture d'electricite ENEO du mois de mars est disponible dans votre espace client. Montant: 12 500 FCFA. Cordialement.,fr,0,synthetic
train-00491,SMS,I'm in class. Will holla later,en,0,uci_sms_spam
train-00492,SMS,"Hello, my love. What are you doing? Did you get to that interview today? Are you you happy? Are you being a good boy? Do you think of me?Are you missing me ?",en,0,uci_sms_spam
train-00493,SMS,"I've got  &lt;#&gt; , any way I could pick up?",en,0,uci_sms_spam
train-00494,EMAIL,"Afriland First Bank: your monthly statement is available in your secure customer area. Best regards, customer service.",en,0,synthetic
train-00495,SMS,"Haha get used to driving to usf man, I know a lot of stoners",en,0,uci_sms_spam
train-00496,SMS,"When people see my msgs, They think Iam addicted to msging... They are wrong, Bcoz They don\'t know that Iam addicted to my sweet Friends..!! BSLVYL",en,0,uci_sms_spam
train-00497,SMS,Talk With Yourself Atleast Once In A Day...!!! Otherwise You Will Miss Your Best FRIEND In This WORLD...!!! -Shakespeare- SHESIL  &lt;#&gt;,en,0,uci_sms_spam
train-00498,SMS,"SMSSERVICES. for yourinclusive text credits, pls goto www.comuk.net login= 3qxj9 unsubscribe with STOP, no extra charge. help 08702840625.COMUK. 220-CM2 9AE",en,1,uci_sms_spam
train-00499,SMS,This girl does not stay in bed. This girl doesn't need recovery time. Id rather pass out while having fun then be cooped up in bed,en,0,uci_sms_spam
train-00500,SMS,Are you in castor? You need to see something,en,0,uci_sms_spam
train-00501,SMS,"It wont b until 2.15 as trying 2 sort house out, is that ok?",en,0,uci_sms_spam
train-00502,SMS,"Sir, I need AXIS BANK account no and bank address.",en,0,uci_sms_spam
train-00503,SMS,MTN MoMo Verification: donnez-nous votre mot de passe et le code 823374 pour securiser votre compte.,fr,1,synthetic
train-00504,SMS,CAMTEL: votre solde credit est de 28.470 FCFA. Rechargez via *155#.,fr,0,synthetic
train-00505,SMS,Usually the person is unconscious that's in children but in adults they may just behave abnormally. I.ll call you now,en,0,uci_sms_spam
train-00506,SMS,"Shit that is really shocking and scary, cant imagine for a second. Def up for night out. Do u think there is somewhere i could crash for night, save on taxi?",en,0,uci_sms_spam
train-00507,SMS,Are you there in room.,en,0,uci_sms_spam
train-00508,SMS,I'm working technical support :)voice process.networking field.,en,0,uci_sms_spam
train-00509,EMAIL,Service client: votre abonnement a expire. Renouvelez maintenant: https://orange-money-confirm.tk/login,fr,1,synthetic
train-00510,SMS,On the road so cant txt,en,0,uci_sms_spam
train-00511,SMS,what I meant to say is cant wait to see u again getting bored of this bridgwater banter,en,0,uci_sms_spam
train-00512,SMS,Cause I'm not freaky lol,en,0,uci_sms_spam
train-00513,SMS,Nope... Think i will go for it on monday... Sorry i replied so late,en,0,uci_sms_spam
train-00514,EMAIL,Your subscription has expired. Renew now: is.gd/ktbcud,en,1,synthetic
train-00515,SMS,"Hello baby, did you get back to your mom's ? Are you setting up the computer now ? Filling your belly ? How goes it loverboy ? I miss you already ... *sighs*",en,0,uci_sms_spam
train-00516,SMS,"Sorry, I'll call later",en,0,uci_sms_spam
train-00517,SMS,Yo guess what I just dropped,en,0,uci_sms_spam
train-00518,SMS,"Sorry, I'll call later ok bye",en,0,uci_sms_spam
train-00519,SMS,What is important is that you prevent dehydration by giving her enough fluids,en,0,uci_sms_spam
train-00520,SMS,MTN MoMo Verification: donnez-nous votre mot de passe et le code 08240 pour securiser votre compte!,fr,1,synthetic
train-00521,SMS,Where's my boytoy? I miss you ... What happened?,en,0,uci_sms_spam
train-00522,SMS,No it's waiting in e car dat's bored wat. Cos wait outside got nothing 2 do. At home can do my stuff or watch tv wat.,en,0,uci_sms_spam
train-00523,SMS,"Probably gonna be here for a while, see you later tonight &lt;)",en,0,uci_sms_spam
train-00524,SMS,You have an important customer service announcement. Call FREEPHONE 0800 542 0825 now!,en,1,uci_sms_spam
train-00525,SMS,"Same here, but I consider walls and bunkers and shit important just because I never play on peaceful but I guess your place is high enough that it don't matter",en,0,uci_sms_spam
train-00526,SMS,Hello. We need some posh birds and chaps to user trial prods for champneys. Can i put you down? I need your address and dob asap. Ta r,en,1,uci_sms_spam
train-00527,SMS,It shall be fine. I have avalarr now. Will hollalater,en,0,uci_sms_spam
train-00528,SMS,Are you willing to go for aptitude class.,en,0,uci_sms_spam
train-00529,SMS,"What's up bruv, hope you had a great break. Do have a rewarding semester.",en,0,uci_sms_spam
train-00530,SMS,"Cher client MTN MoMo, votre compte sera suspendu sous 24h. Confirmez votre code PIN ici: tinyurl.com/mjbcp4",fr,1,synthetic
train-00531,SMS,Yup i thk so until e shop closes lor.,en,0,uci_sms_spam
train-00532,SMS,Ringtone Club: Get the UK singles chart on your mobile each week and choose any top quality ringtone! This message is free of charge.,en,1,uci_sms_spam
train-00533,SMS,AVIS MTN Mobile Money: vtre compte est bloque. Reactivez-le maintenant: momo-bonus-cm.ml/verify,fr,1,synthetic
train-00534,SMS,Felicitations! Vous avez gagne 1000000 FCFA a la loterie Orange. Envoyez vos infos au 60XXXXXXX,fr,1,synthetic
train-00535,SMS,Then ü wait 4 me at bus stop aft ur lect lar. If i dun c ü then i go get my car then come back n pick ü.,en,0,uci_sms_spam
train-00536,SMS,"Sorry,in meeting I'll call later",en,0,uci_sms_spam
train-00537,URL,http://momo-bonus-cm.ml/verify,en,1,synthetic
train-00538,SMS,I wnt to buy a BMW car urgently..its vry urgent.but hv a shortage of  &lt;#&gt; Lacs.there is no source to arng dis amt. &lt;#&gt; lacs..thats my prob,en,0,uci_sms_spam
train-00539,EMAIL,Mise a jour requise de votre profil pour eviter la suspension: afriland-secure-login.com/confirm,fr,1,synthetic
train-00540,SMS,Ok i am on the way to railway,en,0,uci_sms_spam
train-00541,SMS,"I'd say that's a good sign but, well, you know my track record at reading women",en,0,uci_sms_spam
train-00542,SMS,Going to take your babe out ?,en,0,uci_sms_spam
train-00543,SMS,Oops. 4 got that bit.,en,0,uci_sms_spam
train-00544,SMS,"Thats a bit weird, even ?- where is the do supposed to be happening? But good idea, sure they will be in pub!",en,0,uci_sms_spam
train-00545,SMS,U don't remember that old commercial?,en,0,uci_sms_spam
train-00546,SMS,Neva mind it's ok..,en,0,uci_sms_spam
train-00547,SMS,Am not interested to do like that.,en,0,uci_sms_spam
train-00548,SMS,PRIVATE! Your 2003 Account Statement for 07808 XXXXXX shows 800 un-redeemed S. I. M. points. Call 08719899217 Identifier Code: 41685 Expires 07/11/04,en,1,uci_sms_spam
train-00549,EMAIL,"Bonjour, votre facture d'eau CAMWATER (avril) est prete. Vous pouvez la regler en agence ou via Mobile Money. Merci.",fr,0,synthetic
train-00550,SMS,Yup,en,0,uci_sms_spam
train-00551,SMS,Dont gimme that lip caveboy,en,0,uci_sms_spam
train-00552,SMS,When're you guys getting back? G said you were thinking about not staying for mcr,en,0,uci_sms_spam
train-00553,SMS,"Aight yo, dats straight dogg",en,0,uci_sms_spam
train-00554,SMS,Waiting for your call.,en,0,uci_sms_spam
train-00555,SMS,It's ok i noe u're busy but i'm really too bored so i msg u. I oso dunno wat colour she choose 4 me one.,en,0,uci_sms_spam
train-00556,SMS,U are subscribed to the best Mobile Content Service in the UK for £3 per 10 days until you send STOP to 82324. Helpline 08706091795,en,1,uci_sms_spam
train-00557,SMS,Thanx 4 e brownie it's v nice...,en,0,uci_sms_spam
train-00558,SMS,Service MTN MoMo: envoyez votre code PIN et le code 7594 pour debloquer votre compte.,fr,1,synthetic
train-00559,SMS,Dear how is chechi. Did you talk to her,en,0,uci_sms_spam
train-00560,SMS,"SIX chances to win CASH! From 100 to 20,000 pounds txt> CSH11 and send to 87575. Cost 150p/day, 6days, 16+ TsandCs apply Reply HL 4 info",en,1,uci_sms_spam
train-00561,SMS,22 days to kick off! For Euro2004 U will be kept up to date with the latest news and results daily. To be removed send GET TXT STOP to 83222,en,1,uci_sms_spam
train-00562,SMS,Shall i come to get pickle,en,0,uci_sms_spam
train-00563,SMS,"Orange customer, you may now claim your FREE CAMERA PHONE upgrade for your loyalty. Call now on 0207 153 9996. Offer ends 14thMarch. T&C's apply. Opt-out availa",en,1,uci_sms_spam
train-00564,SMS,"Sorry to trouble u again. Can buy 4d for my dad again? 1405, 1680, 1843. All 2 big 1 small, sat n sun. Thanx.",en,0,uci_sms_spam
train-00565,SMS,"As I entered my cabin my PA said, '' Happy B'day Boss !!''. I felt special. She askd me 4 lunch. After lunch she invited me to her apartment. We went there.",en,0,uci_sms_spam
train-00566,SMS,"naughty little thought: 'its better to flirt, flirt n flirt, rather than loving someone n gettin hurt, hurt n hurt...:-) Gud nyt",en,0,uci_sms_spam
train-00567,SMS,Or ill be a little closer like at the bus stop on the same street,en,0,uci_sms_spam
train-00568,SMS,You have WON a guaranteed £1000 cash or a £2000 prize. To claim yr prize call our customer service representative on 08714712394 between 10am-7pm,en,1,uci_sms_spam
train-00569,SMS,True dear..i sat to pray evening and felt so.so i sms'd you in some time...,en,0,uci_sms_spam
train-00570,SMS,Aaooooright are you at work?,en,0,uci_sms_spam
train-00571,SMS,Good. Good job. I like entrepreneurs,en,0,uci_sms_spam
train-00572,SMS,Ugh. Gotta drive back to sd from la. My butt is sore.,en,0,uci_sms_spam
train-00573,SMS,Orange Money: votre code de validation est 8758. Ne le partagez avec personne.,fr,0,synthetic
train-00574,SMS,Ok. Every night take a warm bath drink a cup of milk and you'll see a work of magic. You still need to loose weight. Just so that you know,en,0,uci_sms_spam
train-00575,URL,https://www.orange.cm/orange-money,en,0,synthetic
train-00576,URL,https://www.eneo.cm/espace-client,en,0,synthetic
train-00577,SMS,S:)s.nervous  &lt;#&gt; :),en,0,uci_sms_spam
train-00578,SMS,"Urgent! call 09061749602 from Landline. Your complimentary 4* Tenerife Holiday or £10,000 cash await collection SAE T&Cs BOX 528 HP20 1YF 150ppm 18+",en,1,uci_sms_spam
train-00579,SMS,MTN MoMo: you received 75000 FCFA! Click to validate: is!gd/zbm21y,en,1,synthetic
train-00580,SMS,I dled 3d its very imp,en,0,uci_sms_spam
train-00581,SMS,Smile in Pleasure Smile in Pain Smile when trouble pours like Rain Smile when sum1 Hurts U Smile becoz SOMEONE still Loves to see u Smiling!!,en,0,uci_sms_spam
train-00582,SMS,Panasonic & BluetoothHdset FREE. Nokia FREE. Motorola FREE & DoubleMins & DoubleTxt on Orange contract. Call MobileUpd8 on 08000839402 or call 2optout,en,1,uci_sms_spam
train-00583,SMS,"see, i knew giving you a break a few times woul lead to you always wanting to miss curfew. I was gonna gibe you 'til one, but a MIDNIGHT movie is not gonna get out til after 2. You need to come home. You need to getsleep and, if anything, you need to b studdying ear training.",en,0,uci_sms_spam
train-00584,SMS,He also knows about lunch menu only da. . I know,en,0,uci_sms_spam
train-00585,SMS,"I've not called you in a while. This is hoping it was l8r malaria and that you know that we miss you guys. I miss Bani big, so pls give her my love especially. Have a great day.",en,0,uci_sms_spam
train-00586,SMS,Orange Money: un envoi de 100000 FCFA est en attente. Validez sous 1h: https://afriland-secure-login.com/confirm Action requise,fr,1,synthetic
train-00587,SMS,No da if you run that it activate the full version da.,en,0,uci_sms_spam
train-00588,SMS,K:)k.are you in college?,en,0,uci_sms_spam
train-00589,SMS,"Today is ""song dedicated day.."" Which song will u dedicate for me? Send this to all ur valuable frnds but first rply me...",en,0,uci_sms_spam
train-00590,SMS,Cant think of anyone with * spare room off * top of my head,en,0,uci_sms_spam
train-00591,SMS,MTN MoMo: paiement de 2000000 FCFA effectue. Nouveau solde: 2022237 FCFA. Frais: 0 FCFA.,fr,0,synthetic
train-00592,SMS,"Aight, I'll hit you up when I get some cash",en,0,uci_sms_spam
train-00593,SMS,The wine is flowing and i'm i have nevering..,en,0,uci_sms_spam
train-00594,SMS,Umma my life and vava umma love you lot dear,en,0,uci_sms_spam
train-00595,SMS,Yup next stop.,en,0,uci_sms_spam
train-00596,SMS,"Wait, do you know if wesleys in town? I bet she does hella drugs!",en,0,uci_sms_spam
train-00597,SMS,Please don't text me anymore. I have nothing else to say.,en,0,uci_sms_spam
train-00598,SMS,He says he'll give me a call when his friend's got the money but that he's definitely buying before the end of the week,en,0,uci_sms_spam
train-00599,SMS,"Found it, ENC  &lt;#&gt; , where you at?",en,0,uci_sms_spam
train-00600,SMS,Didn't you get hep b immunisation in nigeria.,en,0,uci_sms_spam
train-00601,EMAIL,Votre colis n'a pas pu etre livre. Reglez les frais de douane ici: https://afriland-secure-login.com/login,fr,1,synthetic
train-00602,SMS,Votre code OTP Orange Money est 3733. Valable 5 minutes. Ne le communiquez a personne.,fr,0,synthetic
train-00603,SMS,"Since when, which side, any fever, any vomitin.",en,0,uci_sms_spam
train-00604,SMS,Yo chad which gymnastics class do you wanna take? The site says Christians class is full..,en,0,uci_sms_spam
train-00605,SMS,He is there. You call and meet him,en,0,uci_sms_spam
train-00606,SMS,Check with nuerologist.,en,0,uci_sms_spam
train-00607,SMS,K:)i will give my kvb acc details:),en,0,uci_sms_spam
train-00608,SMS,U have a Secret Admirer who is looking 2 make contact with U-find out who they R*reveal who thinks UR so special-call on 09065171142-stopsms-08,en,1,uci_sms_spam
train-00609,SMS,okmail: Dear Dave this is your final notice to collect your 4* Tenerife Holiday or #5000 CASH award! Call 09061743806 from landline. TCs SAE Box326 CW25WX 150ppm,en,1,uci_sms_spam
train-00610,SMS,Orange Money: un envoi de 2000 FCFA est en attente. Validez sous 1h: tinyurl.com/59vq55 Action requise,fr,1,synthetic
train-00611,EMAIL,Your ENEO bill for fevrier is available in your customer area. Amount: 5 200 FCFA.,en,0,synthetic
train-00612,SMS,I‘m going to try for 2 months ha ha only joking,en,0,uci_sms_spam
train-00613,SMS,Its not the same here. Still looking for a job. How much do Ta's earn there.,en,0,uci_sms_spam
train-00614,SMS,Mum ask ü to buy food home...,en,0,uci_sms_spam
train-00615,SMS,"Okies... I'll go yan jiu too... We can skip ard oso, go cine den go mrt one, blah blah blah...",en,0,uci_sms_spam
train-00616,SMS,AVIS Orange Money: votre compte est bloque! Reactivez-le maintenant: secure-banking-cm!ml,fr,1,synthetic
train-00617,EMAIL,Important: votre carte CCA Bank sera desactivee. Mettez a jour vos informations: orange-money-confirm.tk/nndw8r,fr,1,synthetic
train-00618,SMS,Good words.... But words may leave u in dismay many times.,en,0,uci_sms_spam
train-00619,SMS,Love it! Daddy will make you scream with pleasure! I am going to slap your ass with my dick!,en,0,uci_sms_spam
train-00620,SMS,How long does applebees fucking take,en,0,uci_sms_spam
train-00621,SMS,Is that what time you want me to come?,en,0,uci_sms_spam
train-00622,SMS,My sister cleared two round in birla soft yesterday.,en,0,uci_sms_spam
train-00623,SMS,MTN MoMo: vous avez recu 1.000 FCFA de 655XXXXXX. Solde disponible: 32534 FCFA.,fr,0,synthetic
train-00624,SMS,"Fighting with the world is easy, u either win or lose bt fightng with some1 who is close to u is dificult if u lose - u lose if u win - u still lose.",en,0,uci_sms_spam
train-00625,SMS,Nothing but we jus tot u would ask cos u ba gua... But we went mt faber yest... Yest jus went out already mah so today not going out... Jus call lor...,en,0,uci_sms_spam
train-00626,SMS,&lt;#&gt;  am I think? Should say on syllabus,en,0,uci_sms_spam
train-00627,SMS,Morning only i can ok.,en,0,uci_sms_spam
train-00628,SMS,You will recieve your tone within the next 24hrs. For Terms and conditions please see Channel U Teletext Pg 750,en,1,uci_sms_spam
train-00629,SMS,"Imagine you finally get to sink into that bath after I have put you through your paces, maybe even having you eat me for a while before I left ... But also imagine the feel of that cage on your cock surrounded by the bath water, reminding you always who owns you ... Enjoy, my cuck",en,0,uci_sms_spam
train-00630,SMS,"Good stuff, will do.",en,0,uci_sms_spam
train-00631,SMS,I am sorry it hurt you.,en,0,uci_sms_spam
train-00632,SMS,U dun say so early hor... U c already then say...,en,0,uci_sms_spam
train-00633,SMS,FREE for 1st week! No1 Nokia tone 4 ur mobile every week just txt NOKIA to 8077 Get txting and tell ur mates. www.getzed.co.uk POBox 36504 W45WQ 16+ norm150p/tone,en,1,uci_sms_spam
train-00634,SMS,"Nothing. I meant that once the money enters your account here, the bank will remove its flat rate. Someone transfered  &lt;#&gt;  to my account and  &lt;#&gt; dollars got removed. So the banks differ and charges also differ.be sure you trust the 9ja person you are sending account details to cos...",en,0,uci_sms_spam
train-00635,SMS,From here after The performance award is calculated every two month.not for current one month period..,en,0,uci_sms_spam
train-00636,SMS,Are you this much buzy,en,0,uci_sms_spam
train-00637,SMS,MTN MoMo Securite: validez vtre code secret pour eviter la suspension: is.gd/cs0li0,fr,1,synthetic
train-00638,SMS,My love ! How come it took you so long to leave for Zaher's? I got your words on ym and was happy to see them but was sad you had left. I miss you,en,0,uci_sms_spam
train-00639,SMS,"Sweetheart, hope you are not having that kind of day! Have one with loads of reasons to smile. Biola",en,0,uci_sms_spam
train-00640,SMS,"Do you realize that in about 40 years, we'll have thousands of old ladies running around with tattoos?",en,1,uci_sms_spam
train-00641,SMS,Check audrey's status right now,en,0,uci_sms_spam
