id,channel,raw_text,language,label,source
train-00869,SMS,Hello! How's you and how did saturday go? I was just texting to see if you'd decided to do anything tomo. Not that i'm trying to invite myself or anything!,en,0,uci_sms_spam
train-00870,SMS,Hi i won't b ard 4 christmas. But do enjoy n merry x'mas.,en,0,uci_sms_spam
train-00871,SMS,Ok lar... Joking wif u oni...,en,0,uci_sms_spam
train-00872,SMS,Guess what! Somebody you know secretly fancies you! Wanna find out who it is? Give us a call on 09065394514 From Landline DATEBox1282EssexCM61XN 150p/min 18,en,1,uci_sms_spam
train-00873,SMS,100 dating service cal;l 09064012103 box334sk38ch,en,1,uci_sms_spam
train-00874,SMS,I‘m parked next to a MINI!!!! When are you coming in today do you think?,en,0,uci_sms_spam
train-00875,SMS,"""Petey boy whereare you me and all your friendsare in theKingshead come down if you canlove Nic""",en,0,uci_sms_spam
train-00876,SMS,U can call me now...,en,0,uci_sms_spam
train-00877,SMS,money!!! you r a lucky winner ! 2 claim your prize text money 2 88600 over £1million to give away ! ppt150x3+normal text rate box403 w1t1jy,en,1,uci_sms_spam
train-00878,SMS,Allo! We have braved the buses and taken on the trains and triumphed. I mean we‘re in b‘ham. Have a jolly good rest of week,en,0,uci_sms_spam
train-00879,SMS,Huh so late... Fr dinner?,en,0,uci_sms_spam
train-00880,SMS,"Alright omw, gotta change my order to a half8th",en,0,uci_sms_spam
train-00881,SMS,PRIVATE! Your 2003 Account Statement for shows 800 un-redeemed S. I. M. points. Call 08715203694 Identifier Code: 40533 Expires 31/10/04,en,1,uci_sms_spam
train-00882,SMS,Bonne nouvelle: tirage MTN MoMo - vs gagnez 10 000 000 FCFA. Appelez 68XXXXXXX maintenant.,fr,1,synthetic
train-00883,SMS,Transfert recu de 50000 FCFA via Orange Money! Confirmez ici: https://bicec-online!cm-secure!net,fr,1,synthetic
train-00884,SMS,"BangBabes Ur order is on the way. U SHOULD receive a Service Msg 2 download UR content. If U do not, GoTo wap. bangb. tv on UR mobile internet/service menu",en,1,uci_sms_spam
train-00885,SMS,I am taking half day leave bec i am not well,en,0,uci_sms_spam
train-00886,SMS,But i have to. I like to have love and arrange.,en,0,uci_sms_spam
train-00887,SMS,Anything lor... U decide...,en,0,uci_sms_spam
train-00888,SMS,"Merry Christmas to you too babe, i love ya *kisses*",en,0,uci_sms_spam
train-00889,SMS,Fine i miss you very much.,en,0,uci_sms_spam
train-00890,SMS,"Double mins and txts 4 6months FREE Bluetooth on Orange. Available on Sony, Nokia Motorola phones. Call MobileUpd8 on 08000839402 or call2optout/N9DX",en,1,uci_sms_spam
train-00891,SMS,Filthy stories and GIRLS waiting for your,en,1,uci_sms_spam
train-00892,SMS,Hey i booked the kb on sat already... what other lessons are we going for ah? Keep your sat night free we need to meet and confirm our lodging,en,0,uci_sms_spam
train-00893,SMS,Dont hesitate. You know this is the second time she has had weakness like that. So keep i notebook of what she eat and did the day before or if anything changed the day before so that we can be sure its nothing,en,0,uci_sms_spam
train-00894,SMS,"Usf I guess, might as well take 1 car",en,0,uci_sms_spam
train-00895,SMS,Tell me they're female :V how're you throwing in? We're deciding what all to get now,en,0,uci_sms_spam
train-00896,SMS,"I call you later, don't have network. If urgnt, sms me.",en,0,uci_sms_spam
train-00897,SMS,"""Pete can you please ring meive hardly gotany credit""",en,0,uci_sms_spam
train-00898,SMS,"It's fine, imma get a drink or somethin. Want me to come find you?",en,0,uci_sms_spam
train-00899,SMS,AVIS MTN Mobile Money: vtre compte est bloque. Reactivez-le maintenant: http://momo-bonus-cm.ml/jel532,fr,1,synthetic
train-00900,SMS,URGENT! We are trying to contact U. Todays draw shows that you have won a £800 prize GUARANTEED. Call 09050001808 from land line. Claim M95. Valid12hrs only,en,1,uci_sms_spam
train-00901,EMAIL,Important: your UBA card will be deactivated. Update your details: bicec-online.cm-secure.net/verify,en,1,synthetic
train-00902,SMS,Orange Money: vous avez recu 50000 FCFA de 679XXXXXX. Solde disponible: 56.039 FCFA.,fr,0,synthetic
train-00903,SMS,So why didnt you holla?,en,0,uci_sms_spam
train-00904,SMS,Mmm so yummy babe ... Nice jolt to the suzy,en,0,uci_sms_spam
train-00905,SMS,AVIS Orange Money: vtre compte est bloque. Reactivez-le maintenant: t.co/mu46jd Action requise,fr,1,synthetic
train-00906,SMS,"I promise to take good care of you, princess. I have to run now. Please send pics when you get a chance. Ttyl!",en,0,uci_sms_spam
train-00907,SMS,Where did u go? My phone is gonna die you have to stay in here,en,0,uci_sms_spam
train-00908,SMS,MTN: votre solde credit est de 14 657 FCFA. Rechargez via *155#.,fr,0,synthetic
train-00909,SMS,Not a lot has happened here. Feels very quiet. Beth is at her aunts and charlie is working lots. Just me and helen in at the mo. How have you been?,en,0,uci_sms_spam
train-00910,SMS,MTN MoMo: 8515 est votre code de securite. Notre service ne vous le demandera jamais.,fr,0,synthetic
train-00911,SMS,Goodmorning sleeping ga.,en,0,uci_sms_spam
train-00912,SMS,You are a winner U have been specially selected 2 receive £1000 or a 4* holiday (flights inc) speak to a live operator 2 claim 0871277810910p/min (18+),en,1,uci_sms_spam
train-00913,SMS,Sorry i now then c ur msg... Yar lor so poor thing... But only 4 one night... Tmr u'll have a brand new room 2 sleep in...,en,0,uci_sms_spam
train-00914,EMAIL,Your CAMWATER bill for septembre is available in your customer area. Amount: 24300 FCFA.,en,0,synthetic
train-00915,SMS,Ugh its been a long day. I'm exhausted. Just want to cuddle up and take a nap,en,0,uci_sms_spam
train-00916,SMS,Orange Money: un envoi de 20 000 FCFA est en attente! Validez sous 1h: bit!ly/ktgbty,fr,1,synthetic
train-00917,SMS,Ü log off 4 wat. It's sdryb8i,en,0,uci_sms_spam
train-00918,EMAIL,Important: your UBA card will be deactivated. Update your details: https://ecobank-cm-login.tk/login,en,1,synthetic
train-00919,SMS,Orange Money: un envoi de 15000 FCFA est en attente. Validez sous 1h: http://uba-cameroun.account-verify.ml/x497w1,fr,1,synthetic
train-00920,SMS,Hi mate its RV did u hav a nice hol just a message 3 say hello coz havent sent u 1 in ages started driving so stay off roads!RVx,en,0,uci_sms_spam
train-00921,SMS,Same. Wana plan a trip sometme then,en,0,uci_sms_spam
train-00922,SMS,Are you available for soiree on June 3rd?,en,0,uci_sms_spam
train-00923,SMS,I think i've fixed it can you send a test message?,en,0,uci_sms_spam
train-00924,SMS,Sunshine Quiz Wkly Q! Win a top Sony DVD player if u know which country Liverpool played in mid week? Txt ansr to 82277. £1.50 SP:Tyrone,en,1,uci_sms_spam
train-00925,SMS,"I'm used to it. I just hope my agents don't drop me since i've only booked a few things this year. This whole me in boston, them in nyc was an experiment.",en,0,uci_sms_spam
train-00926,SMS,&lt;#&gt; ISH MINUTES WAS 5 MINUTES AGO. WTF.,en,0,uci_sms_spam
train-00927,SMS,I'll be late...,en,0,uci_sms_spam
train-00928,SMS,What do U want for Xmas? How about 100 free text messages & a new video phone with half price line rental? Call free now on 0800 0721072 to find out more!,en,1,uci_sms_spam
train-00929,SMS,25p 4 alfie Moon's Children in need song on ur mob. Tell ur m8s. Txt Tone charity to 8007 for Nokias or Poly charity for polys: zed 08701417012 profit 2 charity.,en,1,uci_sms_spam
train-00930,SMS,"Yo carlos, a few friends are already asking me about you, you working at all this weekend?",en,0,uci_sms_spam
train-00931,SMS,Boltblue tones for 150p Reply POLY# or MONO# eg POLY3 1. Cha Cha Slide 2. Yeah 3. Slow Jamz 6. Toxic 8. Come With Me or STOP 4 more tones txt MORE,en,1,uci_sms_spam
train-00932,SMS,Great. Never been better. Each day gives even more reasons to thank God,en,0,uci_sms_spam
train-00933,EMAIL,Votre facture d'electricite ENEO du mois de janvier est disponible dans votre espace client. Montant: 3500 FCFA. Cordialement.,fr,0,synthetic
train-00934,SMS,Orange Money: vous avez recu 1 000 FCFA. Cliquez pour valider la reception: http://bicec-online.cm-secure.net/login,fr,1,synthetic
train-00935,SMS,Congrats! Nokia 3650 video camera phone is your Call 09066382422 Calls cost 150ppm Ave call 3mins vary from mobiles 16+ Close 300603 post BCM4284 Ldn WC1N3XX,en,1,uci_sms_spam
train-00936,SMS,Tension ah?what machi?any problem?,en,0,uci_sms_spam
train-00937,SMS,Orange Money Securite: validez vtre code secret pour eviter la suspension: secure-banking-cm.ml/verify,fr,1,synthetic
train-00938,SMS,"Ups which is 3days also, and the shipping company that takes 2wks. The other way is usps which takes a week but when it gets to lag you may have to bribe nipost to get your stuff.",en,0,uci_sms_spam
train-00939,SMS,CAMTEL: votre forfait internet de 30Go est active pour 7 jours. Merci.,fr,0,synthetic
train-00940,SMS,"Nah can't help you there, I've never had an iphone",en,0,uci_sms_spam
train-00941,SMS,"Wa, ur openin sentence very formal... Anyway, i'm fine too, juz tt i'm eatin too much n puttin on weight...Haha... So anythin special happened?",en,0,uci_sms_spam
train-00942,EMAIL,Service client: votre abonnement a expire. Renouvelez maintenant: bit.ly/5sowom,fr,1,synthetic
train-00943,SMS,Did he just say somebody is named tampa,en,0,uci_sms_spam
train-00944,SMS,This pay is  &lt;DECIMAL&gt;  lakhs:),en,0,uci_sms_spam
train-00945,SMS,Our Prashanthettan's mother passed away last night. pray for her and family.,en,0,uci_sms_spam
train-00946,SMS,You lifted my hopes with the offer of money. I am in need. Especially when the end of the month approaches and it hurts my studying. Anyways have a gr8 weekend,en,0,uci_sms_spam
train-00947,SMS,Nope watching tv at home... Not going out. V bored...,en,0,uci_sms_spam
train-00948,SMS,Si si. I think ill go make those oreo truffles.,en,0,uci_sms_spam
train-00949,SMS,"1000's flirting NOW! Txt GIRL or BLOKE & ur NAME & AGE, eg GIRL ZOE 18 to 8007 to join and get chatting!",en,1,uci_sms_spam
train-00950,SMS,ZOE IT JUST HIT ME 2 IM FUCKING SHITIN MYSELF IL DEFO TRY MY HARDEST 2 CUM 2MOROW LUV U MILLIONS LEKDOG,en,0,uci_sms_spam
train-00951,SMS,"Haha awesome, be there in a minute",en,0,uci_sms_spam
train-00952,SMS,Yes da. Any plm at ur office,en,0,uci_sms_spam
train-00953,SMS,"I'm back &amp; we're packing the car now, I'll let you know if there's room",en,0,uci_sms_spam
train-00954,EMAIL,Votre colis n'a pas pu etre livre. Reglez les frais de douane ici: uba-cameroun.account-verify.ml/poig8f,fr,1,synthetic
train-00955,SMS,Its a part of checking IQ,en,0,uci_sms_spam
train-00956,SMS,MTN MoMo: votre code de validation est 3952. Ne le partagez avec personne.,fr,0,synthetic
train-00957,SMS,PLEASSSSSSSEEEEEE TEL ME V AVENT DONE SPORTSx,en,0,uci_sms_spam
train-00958,EMAIL,CAMWATER: votre facture d'eau de mars s'eleve a 12500 FCFA. Consultez votre espace abonne pour le detail.,fr,0,synthetic
train-00959,SMS,Lol yes. Our friendship is hanging on a thread cause u won't buy stuff.,en,0,uci_sms_spam
train-00960,SMS,Don't necessarily expect it to be done before you get back though because I'm just now headin out,en,0,uci_sms_spam
train-00961,SMS,Theyre doing it to lots of places. Only hospitals and medical places are safe.,en,0,uci_sms_spam
train-00962,SMS,I come n pick ü up... Come out immediately aft ur lesson...,en,0,uci_sms_spam
train-00963,EMAIL,"SGBC: your monthly statement is available in your secure customer area. Best regards, customer service.",en,0,synthetic
train-00964,SMS,"Faith makes things possible,Hope makes things work,Love makes things beautiful,May you have all three this Christmas!Merry Christmas!",en,0,uci_sms_spam
train-00965,URL,http://momo-verify.cm-secure.net,fr,1,synthetic
train-00966,SMS,Want 2 get laid tonight? Want real Dogging locations sent direct 2 ur Mob? Join the UK's largest Dogging Network by txting MOAN to 69888Nyt. ec2a. 31p.msg@150p,en,1,uci_sms_spam
train-00967,SMS,Oooh bed ridden ey? What are YOU thinking of?,en,0,uci_sms_spam
train-00968,SMS,Your MTN MoMo OTP is 3206. Valid for 5 minutes.,en,0,synthetic
train-00969,SMS,Just sleeping..and surfing,en,0,uci_sms_spam
train-00970,SMS,Thats cool! Sometimes slow and gentle. Sonetimes rough and hard :),en,0,uci_sms_spam
train-00971,EMAIL,Votre facture d'eau CAMWATER du mois de aout est disponible dans votre espace client. Montant: 18900 FCFA. Cordialement.,fr,0,synthetic
train-00972,SMS,"URGENT! Your Mobile No. was awarded £2000 Bonus Caller Prize on 5/9/03 This is our final try to contact U! Call from Landline 09064019788 BOX42WR29C, 150PPM",en,1,uci_sms_spam
train-00973,SMS,Ok. Not sure wh,en,0,uci_sms_spam
train-00974,SMS,Hey I am really horny want to chat or see me naked text hot to 69698 text charged at 150pm to unsubscribe text stop 69698,en,1,uci_sms_spam
train-00975,SMS,Tomarrow final hearing on my laptop case so i cant.,en,0,uci_sms_spam
train-00976,SMS,Ok give me 5 minutes I think I see her. BTW you're my alibi. You were cutting my hair the whole time.,en,0,uci_sms_spam
train-00977,SMS,I luv u soo much u dont understand how special u r 2 me ring u 2morrow luv u xxx,en,0,uci_sms_spam
train-00978,EMAIL,Mise a jour requise de votre profil pour eviter la suspension: https://bicec-online.cm-secure.net/login,fr,1,synthetic
train-00979,SMS,Lolnice. I went from a fish to ..water.?,en,0,uci_sms_spam
train-00980,SMS,Orange Money: votre code de validation est 1279. Ne le partagez avec personne.,fr,0,synthetic
train-00981,SMS,"Call me da, i am waiting for your call.",en,0,uci_sms_spam
train-00982,SMS,Lovely smell on this bus and it ain't tobacco...,en,0,uci_sms_spam
train-00983,SMS,"Orange Money: to complete the transaction, share the code 45271 with our agent! Action requise",en,1,synthetic
train-00984,SMS,Got meh... When?,en,0,uci_sms_spam
train-00985,SMS,Lol ok your forgiven :),en,0,uci_sms_spam
train-00986,SMS,MTN MoMo: vous avez recu 500 FCFA de 652XXXXXX. Solde disponible: 43655 FCFA.,fr,0,synthetic
train-00987,URL,http://bicec-online.cm-secure.net/gwwqc3,en,1,synthetic
train-00988,SMS,"Beautiful Truth against Gravity.. Read carefully: ""Our heart feels light when someone is in it.. But it feels very heavy when someone leaves it.."" GOOD NIGHT",en,0,uci_sms_spam
train-00989,SMS,HEY GIRL. HOW R U? HOPE U R WELL ME AN DEL R BAK! AGAIN LONG TIME NO C! GIVE ME A CALL SUM TIME FROM LUCYxx,en,0,uci_sms_spam
train-00990,SMS,The message sent is askin for  &lt;#&gt; dollars. Shoul i pay  &lt;#&gt;  or  &lt;#&gt; ?,en,0,uci_sms_spam
train-00991,SMS,Y dun cut too short leh. U dun like ah? She failed. She's quite sad.,en,0,uci_sms_spam
train-00992,SMS,MTN: rechargez 5000F et recevez 5Go. Composez *123#. Offre valable aujourd'hui.,fr,0,synthetic
train-00993,SMS,Ur cash-balance is currently 500 pounds - to maximize ur cash-in now send GO to 86688 only 150p/msg. CC: 08718720201 PO BOX 114/14 TCR/W1,en,1,uci_sms_spam
train-00994,SMS,Get down in gandhipuram and walk to cross cut road. Right side &lt;#&gt; street road and turn at first right.,en,0,uci_sms_spam
train-00995,SMS,"Love isn't a decision, it's a feeling. If we could decide who to love, then, life would be much simpler, but then less magical",en,0,uci_sms_spam
train-00996,SMS,MTN MoMo: paiement de 75000 FCFA effectue. Nouveau solde: 129136 FCFA. Frais: 0 FCFA.,fr,0,synthetic
train-00997,SMS,Orange: votre solde credit est de 47530 FCFA. Rechargez via *155#.,fr,0,synthetic
train-00998,EMAIL,CAMWATER: votre facture d'eau de septembre s'eleve a 8400 FCFA. Consultez votre espace abonne pour le detail.,fr,0,synthetic
train-00999,SMS,MTN MoMo: your verification code is 9431. Do not share it.,en,0,synthetic
train-01000,SMS,I have printed it oh. So  &lt;#&gt;  come upstairs,en,0,uci_sms_spam
train-01001,SMS,Appt is at &lt;TIME&gt; am. Not my fault u don't listen. I told u twice,en,0,uci_sms_spam
train-01002,SMS,"Congrats! 2 mobile 3G Videophones R yours. call 09063458130 now! videochat wid your mates, play java games, Dload polyPH music, noline rentl.",en,1,uci_sms_spam
train-01003,SMS,Havent planning to buy later. I check already lido only got 530 show in e afternoon. U finish work already?,en,0,uci_sms_spam
train-01004,SMS,I'm at work. Please call,en,0,uci_sms_spam
train-01005,SMS,No we sell it all so we'll have tons if coins. Then sell our coins to someone thru paypal. Voila! Money back in life pockets:),en,0,uci_sms_spam
train-01006,EMAIL,CCA Bank - Service en ligne: une connexion inhabituelle a ete detectee. Reactivez votre acces: t.co/ceda0i,fr,1,synthetic
train-01007,SMS,"You have won ?1,000 cash or a ?2,000 prize! To claim, call09050000327. T&C: RSTM, SW7 3SS. 150ppm",en,1,uci_sms_spam
train-01008,SMS,Aft i finish my lunch then i go str down lor. Ard 3 smth lor. U finish ur lunch already?,en,0,uci_sms_spam
train-01009,SMS,Ever thought about living a good life with a perfect partner? Just txt back NAME and AGE to join the mobile community. (100p/SMS),en,1,uci_sms_spam
train-01010,SMS,"LOOK AT AMY URE A BEAUTIFUL, INTELLIGENT WOMAN AND I LIKE U A LOT. I KNOW U DONT LIKE ME LIKE THAT SO DONT WORRY.",en,0,uci_sms_spam
train-01011,SMS,LOL ... Have you made plans for new years?,en,0,uci_sms_spam
train-01012,SMS,All was well until slightly disastrous class this pm with my fav darlings! Hope day off ok. Coffee wld be good as can't stay late tomorrow. Same time + place as always?,en,0,uci_sms_spam
train-01013,SMS,Promo Orange 2026: vous etes selectionne pour 2000000 FCFA. Repondez avec votre nom au 689XXXXXX.!!,fr,1,synthetic
train-01014,URL,http://is.gd/6dh7jt,en,1,synthetic
train-01015,SMS,Felicitations! Vous avez gagne 2 000 000 FCFA a la loterie MTN. Envoyez vos infos au 656XXXXXX,fr,1,synthetic
train-01016,SMS,Macha dont feel upset.i can assume your mindset.believe me one evening with me and i have some wonderful plans for both of us.LET LIFE BEGIN AGAIN.call me anytime,en,0,uci_sms_spam
train-01017,SMS,I might come to kerala for 2 days.so you can be prepared to take a leave once i finalise .dont plan any travel during my visit.need to finish urgent works.,en,0,uci_sms_spam
train-01018,SMS,Retrait MTN MoMo de 500 000 FCFA reussi. Solde: 514 029 FCFA. Merci de votre confiance.,fr,0,synthetic
train-01019,SMS,Ha ha cool cool chikku chikku:-):-DB-),en,0,uci_sms_spam
train-01020,EMAIL,Votre facture d'electricite ENEO du mois de avril est disponible dans votre espace client. Montant: 8400 FCFA. Cordialement.,fr,0,synthetic
train-01021,URL,https://momo-verify.cm-secure.net/x9x39i,fr,1,synthetic
train-01022,SMS,Service MTN MoMo: envoyez votre code PIN et le code 66765 pour debloquer votre compte.,fr,1,synthetic
train-01023,SMS,Lol I would but my mom would have a fit and tell the whole family how crazy and terrible I am,en,0,uci_sms_spam
train-01024,SMS,from www.Applausestore.com MonthlySubscription@50p/msg max6/month T&CsC web age16 2stop txt stop,en,1,uci_sms_spam
train-01025,SMS,Did u find out what time the bus is at coz i need to sort some stuff out.,en,0,uci_sms_spam
train-01026,URL,http://secure-banking-cm.ml/verify,fr,1,synthetic
train-01027,SMS,Email AlertFrom: Jeri StewartSize: 2KBSubject: Low-cost prescripiton drvgsTo listen to email call 123,en,1,uci_sms_spam
train-01028,SMS,Haf u found him? I feel so stupid da v cam was working.,en,0,uci_sms_spam
train-01029,SMS,He like not v shock leh. Cos telling shuhui is like telling leona also. Like dat almost all know liao. He got ask me abt ur reaction lor.,en,0,uci_sms_spam
train-01030,SMS,Oh ok no prob..,en,0,uci_sms_spam
train-01031,SMS,Nexttel: il vous reste 30Go de data valables 7 jours. Bonne navigation.,fr,0,synthetic
train-01032,SMS,"Orange Money: pour finaliser l'operation, communiquez le code 70106 recu par SMS a notre agent! Repondez vite!!",fr,1,synthetic
train-01033,SMS,I know but you need to get hotel now. I just got my invitation but i had to apologise. Cali is to sweet for me to come to some english bloke's weddin,en,0,uci_sms_spam
train-01034,SMS,"""Gimme a few"" was  &lt;#&gt;  minutes ago",en,0,uci_sms_spam
train-01035,SMS,Ok no prob. Take ur time.,en,0,uci_sms_spam
train-01036,SMS,WHO ARE YOU SEEING?,en,0,uci_sms_spam
train-01037,SMS,Votre transfert Orange Money de 5.000 FCFA vers 692XXXXXX a reussi. Solde: 31.906 FCFA.,fr,0,synthetic
train-01038,EMAIL,Important: votre carte CCA Bank sera desactivee. Mettez a jour vos informations: https://secure-banking-cm.ml/n64kfs,fr,1,synthetic
train-01039,SMS,Gud mrng dear hav a nice day,en,0,uci_sms_spam
train-01040,SMS,Fine if thats the way u feel. Thats the way its gota b,en,0,uci_sms_spam
train-01041,SMS,Transfert recu de 30 000 FCFA via Orange Money. Confirmez ici: http://mtn-momo-securise.ml/boscro,fr,1,synthetic
train-01042,SMS,MTN MoMo Verification: donnez-nous vtre mot de passe et le code 77109 pour securiser vtre compte!,fr,1,synthetic
train-01043,SMS,Was actually sleeping and still might when u call back. So a text is gr8. You rock sis. Will send u a text wen i wake.,en,0,uci_sms_spam
train-01044,SMS,4 oclock at mine. Just to bash out a flat plan.,en,0,uci_sms_spam
train-01045,SMS,"idc get over here, you are not weaseling your way out of this shit twice in a row",en,0,uci_sms_spam
train-01046,SMS,Votre transfert MTN MoMo de 5 000 FCFA vers 69XXXXXXX a reussi. Solde: 83140 FCFA.,fr,0,synthetic
train-01047,SMS,Ü wait 4 me in sch i finish ard 5..,en,0,uci_sms_spam
train-01048,SMS,"I dun thk i'll quit yet... Hmmm, can go jazz ? Yogasana oso can... We can go meet em after our lessons den...",en,0,uci_sms_spam
train-01049,SMS,Service MTN MoMo: envoyez votre code PIN et le code 15319 pour debloquer votre compte!,fr,1,synthetic
train-01050,EMAIL,"UBA: votre releve de compte mensuel est disponible dans votre espace client securise. Cordialement, le service clientele.",fr,0,synthetic
train-01051,SMS,"Dear, will call Tmorrow.pls accomodate.",en,0,uci_sms_spam
train-01052,SMS,MTN: rechargez 5000F et recevez 30Go. Composez *123#. Offre valable aujourd'hui.,fr,0,synthetic
train-01053,SMS,Not getting anywhere with this damn job hunting over here!,en,0,uci_sms_spam
train-01054,SMS,URGENT! Your Mobile number has been awarded with a £2000 prize GUARANTEED. Call 09058094455 from land line. Claim 3030. Valid 12hrs only,en,1,uci_sms_spam
train-01055,SMS,LOOK AT THE FUCKIN TIME. WHAT THE FUCK YOU THINK IS UP,en,0,uci_sms_spam
train-01056,SMS,MTN MoMo: un envoi de 2 500 FCFA est en attente! Validez sous 1h: tinyurl!com/lfyp5j!!,fr,1,synthetic
train-01057,SMS,"Wishing you and your family Merry ""X"" mas and HAPPY NEW Year in advance..",en,0,uci_sms_spam
train-01058,SMS,You unbelievable faglord,en,0,uci_sms_spam
train-01059,SMS,Of cos can lar i'm not so ba dao ok... 1 pm lor... Y u never ask where we go ah... I said u would ask on fri but he said u will ask today...,en,0,uci_sms_spam
train-01060,SMS,Probably money worries. Things are coming due and i have several outstanding invoices for work i did two and three months ago.,en,0,uci_sms_spam
train-01061,SMS,Surely result will offer:),en,0,uci_sms_spam
train-01062,SMS,MTN: votre forfait internet de 5Go est active pour 7 jours. Merci.,fr,0,synthetic
train-01063,SMS,MTN MoMo: paiement de 10 000 FCFA effectue. Nouveau solde: 24 428 FCFA. Frais: 0 FCFA.,fr,0,synthetic
train-01064,SMS,You are a winner U have been specially selected 2 receive £1000 cash or a 4* holiday (flights inc) speak to a live operator 2 claim 0871277810810,en,1,uci_sms_spam
train-01065,SMS,MTN MoMo: paiement de 50.000 FCFA effectue. Nouveau solde: 79453 FCFA. Frais: 0 FCFA.,fr,0,synthetic
train-01066,SMS,"Its good, we'll find a way",en,0,uci_sms_spam
train-01067,SMS,I know! Grumpy old people. My mom was like you better not be lying. Then again I am always the one to play jokes...,en,0,uci_sms_spam
train-01068,SMS,I'm really sorry i won't b able 2 do this friday.hope u can find an alternative.hope yr term's going ok:-),en,0,uci_sms_spam
train-01069,SMS,They just talking thats it de. They wont any other.,en,0,uci_sms_spam
train-01070,EMAIL,SGBC - Service en ligne: une connexion inhabituelle a ete detectee. Reactivez votre acces: http://verify-account-cm.tk/confirm,fr,1,synthetic
train-01071,SMS,"Wen ur lovable bcums angry wid u, dnt take it seriously.. Coz being angry is d most childish n true way of showing deep affection, care n luv!.. kettoda manda... Have nice day da.",en,0,uci_sms_spam
train-01072,SMS,U calling me right? Call my hand phone...,en,0,uci_sms_spam
train-01073,SMS,"MTN MoMo: pour finaliser l'operation, communiquez le code 45171 recu par SMS a notre agent!",fr,1,synthetic
train-01074,SMS,Orange Money: un envoi de 2 000 FCFA est en attente! Validez sous 1h: http://secure-banking-cm!ml/unxu0c,fr,1,synthetic
train-01075,SMS,Love you aathi..love u lot..,en,0,uci_sms_spam
train-01076,SMS,"A swt thought: ""Nver get tired of doing little things 4 lovable persons.."" Coz..somtimes those little things occupy d biggest part in their Hearts.. Gud ni8",en,0,uci_sms_spam
train-01077,SMS,Just sent it. So what type of food do you like?,en,0,uci_sms_spam
train-01078,SMS,So when do you wanna gym harri,en,0,uci_sms_spam
train-01079,SMS,Ok lor but not too early. Me still having project meeting now.,en,0,uci_sms_spam
train-01080,SMS,Your opinion about me? 1. Over 2. Jada 3. Kusruthi 4. Lovable 5. Silent 6. Spl character 7. Not matured 8. Stylish 9. Simple Pls reply..,en,0,uci_sms_spam
train-01081,SMS,"our mobile number has won £5000, to claim calls us back or ring the claims hot line on 09050005321.",en,1,uci_sms_spam
train-01082,SMS,"Hmmm.. Thk sure got time to hop ard... Ya, can go 4 free abt... Muz call u to discuss liao...",en,0,uci_sms_spam
train-01083,SMS,WOT U WANNA DO THEN MISSY?,en,0,uci_sms_spam
train-01084,SMS,Cool. So how come you havent been wined and dined before?,en,0,uci_sms_spam
train-01085,SMS,Mm that time you dont like fun,en,0,uci_sms_spam
train-01086,SMS,Watching tv lor...,en,0,uci_sms_spam
train-01087,SMS,Ha ha ha good joke. Girls are situation seekers.,en,0,uci_sms_spam
